[
  {
    "course_id": "math.core",
    "subject_id": "math",
    "title": "Core Mathematics",
    "description": "Mathematics from the ground up: number foundations through introductory algebra.",
    "version": "0.1.0",
    "status": "draft",
    "units": [
      { "unit_id": "math.number_foundations", "title": "Number Foundations", "order": 1 },
      { "unit_id": "math.add_sub", "title": "Addition and Subtraction", "order": 2 },
      { "unit_id": "math.mult_div", "title": "Multiplication and Division", "order": 3 },
      { "unit_id": "math.numerical_structure", "title": "Numerical Structure", "order": 4 },
      { "unit_id": "math.integers", "title": "Integers", "order": 5 },
      { "unit_id": "math.fractions", "title": "Fractions", "order": 6 },
      { "unit_id": "math.decimals_percents", "title": "Decimals and Percentages", "order": 7 },
      { "unit_id": "math.ratios", "title": "Ratios and Proportions", "order": 8 },
      { "unit_id": "math.measurement", "title": "Measurement Foundations", "order": 9 },
      { "unit_id": "math.algebra", "title": "Algebra Foundations", "order": 10 }
    ]
  },
  {
    "course_id": "science.core",
    "subject_id": "science",
    "title": "Scientific Reasoning and Measurement",
    "description": "Scientific thinking and measurement from the ground up.",
    "version": "0.1.0",
    "status": "draft",
    "units": [
      { "unit_id": "science.thinking", "title": "Scientific Thinking", "order": 1 },
      { "unit_id": "science.measurement", "title": "Measurement", "order": 2 }
    ]
  }
]
