[
  {
    "course_id": "math.core",
    "subject_id": "math",
    "title": "Core Mathematics",
    "description": "Mathematics from the ground up.",
    "version": "0.1.0",
    "status": "draft",
    "units": [
      { "unit_id": "math.number_foundations", "title": "Number Foundations", "order": 1 },
      { "unit_id": "math.add_sub", "title": "Addition and Subtraction", "order": 2 }
    ]
  }
]
